{
  "pmf_version": "0.2.0",
  "kind": "actual",
  "generated_at": "2026-10-18T22:32:17Z",
  "repo_root": "toy_project",
  "scanner": {
    "name": "pmap-python-ast",
    "version": "0.2.0"
  },
  "import_roots": [
    "."
  ],
  "errors": [],
  "nodes": [
    {
      "id": "mod:app.db",
      "kind": "module",
      "name": "db",
      "qualified_name": "app.db",
      "parent_id": null,
      "external": false,
      "signature": null,
      "docstring_summary": "Database package for toy_project.",
      "location": {
        "path": "app/db/__init__.py",
        "line_start": 1,
        "line_end": 1,
        "file_hash": "sha256:d9beaaa4f2de79c5561d4ac8074cefd99f67cc8a708b37e77824bf9ed8b73500"
      }
    },
    {
      "id": "mod:app.db.connection",
      "kind": "module",
      "name": "connection",
      "qualified_name": "app.db.connection",
      "parent_id": null,
      "external": false,
      "signature": null,
      "docstring_summary": "Low-level database connection and storage.",
      "location": {
        "path": "app/db/connection.py",
        "line_start": 1,
        "line_end": 21,
        "file_hash": "sha256:068cbbd345f13f56f880a6771aaedc4e8527accc08f4db89782d49a35ee67a0c"
      }
    },
    {
      "id": "mod:app.db.repository",
      "kind": "module",
      "name": "repository",
      "qualified_name": "app.db.repository",
      "parent_id": null,
      "external": false,
      "signature": null,
      "docstring_summary": "Repository implementations for domain entities.",
      "location": {
        "path": "app/db/repository.py",
        "line_start": 1,
        "line_end": 24,
        "file_hash": "sha256:6d69e2a35226eff4064b7218f6564cbca9c52b6a3438b419ab588be12b30fc1c"
      }
    },
    {
      "id": "mod:app.models",
      "kind": "module",
      "name": "models",
      "qualified_name": "app.models",
      "parent_id": null,
      "external": false,
      "signature": null,
      "docstring_summary": "Models package for toy_project.",
      "location": {
        "path": "app/models/__init__.py",
        "line_start": 1,
        "line_end": 1,
        "file_hash": "sha256:3fe6ea949176316d16af3437411d30d82a03e4466b95f875b02e533dcb355dbe"
      }
    },
    {
      "id": "mod:app.models.order",
      "kind": "module",
      "name": "order",
      "qualified_name": "app.models.order",
      "parent_id": null,
      "external": false,
      "signature": null,
      "docstring_summary": "Domain models for orders.",
      "location": {
        "path": "app/models/order.py",
        "line_start": 1,
        "line_end": 16,
        "file_hash": "sha256:e0079461d1dd36a89376a50e28277281bb0e48def00d47e7b5139d13c77b3322"
      }
    },
    {
      "id": "mod:app.services",
      "kind": "module",
      "name": "services",
      "qualified_name": "app.services",
      "parent_id": null,
      "external": false,
      "signature": null,
      "docstring_summary": "Services package for toy_project.",
      "location": {
        "path": "app/services/__init__.py",
        "line_start": 1,
        "line_end": 1,
        "file_hash": "sha256:15c6c1746cc2e5fe43b69dce19559b5205639e008320d8e71529fd55f246e861"
      }
    },
    {
      "id": "mod:app.services.order_service",
      "kind": "module",
      "name": "order_service",
      "qualified_name": "app.services.order_service",
      "parent_id": null,
      "external": false,
      "signature": null,
      "docstring_summary": "Business logic for creating and processing customer orders.",
      "location": {
        "path": "app/services/order_service.py",
        "line_start": 1,
        "line_end": 32,
        "file_hash": "sha256:c66cc3d46655f4dd9bddb2da54585a46f4b1c4cd8e582c09d9b248c1b3abe817"
      }
    },
    {
      "id": "mod:app.ui",
      "kind": "module",
      "name": "ui",
      "qualified_name": "app.ui",
      "parent_id": null,
      "external": false,
      "signature": null,
      "docstring_summary": "UI package for toy_project.",
      "location": {
        "path": "app/ui/__init__.py",
        "line_start": 1,
        "line_end": 1,
        "file_hash": "sha256:73b5f4394cd4d150367c62b570fd2bfe22b51f4d6b30ceda06411a1282c7c57f"
      }
    },
    {
      "id": "mod:app.ui.cli",
      "kind": "module",
      "name": "cli",
      "qualified_name": "app.ui.cli",
      "parent_id": null,
      "external": false,
      "signature": null,
      "docstring_summary": "Command-line interface for interacting with the order system.",
      "location": {
        "path": "app/ui/cli.py",
        "line_start": 1,
        "line_end": 24,
        "file_hash": "sha256:f2ddf78b7322f88504f2f1faedd1d7dcc7f8f84364401a386e6ab609796356e8"
      }
    },
    {
      "id": "sym:app.db.connection:DatabaseConnection",
      "kind": "class",
      "name": "DatabaseConnection",
      "qualified_name": "app.db.connection.DatabaseConnection",
      "parent_id": "mod:app.db.connection",
      "external": false,
      "signature": null,
      "docstring_summary": "In-memory database connection handle.",
      "location": {
        "path": "app/db/connection.py",
        "line_start": 6,
        "line_end": 14,
        "file_hash": "sha256:068cbbd345f13f56f880a6771aaedc4e8527accc08f4db89782d49a35ee67a0c"
      }
    },
    {
      "id": "sym:app.db.connection:DatabaseConnection.execute_insert",
      "kind": "method",
      "name": "execute_insert",
      "qualified_name": "app.db.connection.DatabaseConnection.execute_insert",
      "parent_id": "sym:app.db.connection:DatabaseConnection",
      "external": false,
      "signature": "(self, record: dict) -> int",
      "docstring_summary": "Insert a raw record into storage and return its assigned ID.",
      "location": {
        "path": "app/db/connection.py",
        "line_start": 9,
        "line_end": 14,
        "file_hash": "sha256:068cbbd345f13f56f880a6771aaedc4e8527accc08f4db89782d49a35ee67a0c"
      }
    },
    {
      "id": "sym:app.db.connection:execute_raw_sql",
      "kind": "function",
      "name": "execute_raw_sql",
      "qualified_name": "app.db.connection.execute_raw_sql",
      "parent_id": "mod:app.db.connection",
      "external": false,
      "signature": "(query: str) -> list[dict]",
      "docstring_summary": "Execute a raw query directly against the storage engine.",
      "location": {
        "path": "app/db/connection.py",
        "line_start": 17,
        "line_end": 21,
        "file_hash": "sha256:068cbbd345f13f56f880a6771aaedc4e8527accc08f4db89782d49a35ee67a0c"
      }
    },
    {
      "id": "sym:app.db.repository:BaseRepository",
      "kind": "class",
      "name": "BaseRepository",
      "qualified_name": "app.db.repository.BaseRepository",
      "parent_id": "mod:app.db.repository",
      "external": false,
      "signature": null,
      "docstring_summary": "Base repository providing connection lifecycle.",
      "location": {
        "path": "app/db/repository.py",
        "line_start": 7,
        "line_end": 11,
        "file_hash": "sha256:6d69e2a35226eff4064b7218f6564cbca9c52b6a3438b419ab588be12b30fc1c"
      }
    },
    {
      "id": "sym:app.db.repository:BaseRepository.__init__",
      "kind": "method",
      "name": "__init__",
      "qualified_name": "app.db.repository.BaseRepository.__init__",
      "parent_id": "sym:app.db.repository:BaseRepository",
      "external": false,
      "signature": "(self) -> None",
      "docstring_summary": null,
      "location": {
        "path": "app/db/repository.py",
        "line_start": 10,
        "line_end": 11,
        "file_hash": "sha256:6d69e2a35226eff4064b7218f6564cbca9c52b6a3438b419ab588be12b30fc1c"
      }
    },
    {
      "id": "sym:app.db.repository:OrderRepository",
      "kind": "class",
      "name": "OrderRepository",
      "qualified_name": "app.db.repository.OrderRepository",
      "parent_id": "mod:app.db.repository",
      "external": false,
      "signature": null,
      "docstring_summary": "Persistence repository for Order entities.",
      "location": {
        "path": "app/db/repository.py",
        "line_start": 14,
        "line_end": 24,
        "file_hash": "sha256:6d69e2a35226eff4064b7218f6564cbca9c52b6a3438b419ab588be12b30fc1c"
      }
    },
    {
      "id": "sym:app.db.repository:OrderRepository.save_order",
      "kind": "method",
      "name": "save_order",
      "qualified_name": "app.db.repository.OrderRepository.save_order",
      "parent_id": "sym:app.db.repository:OrderRepository",
      "external": false,
      "signature": "(self, order: Order) -> int",
      "docstring_summary": "Persist a validated Order instance.",
      "location": {
        "path": "app/db/repository.py",
        "line_start": 17,
        "line_end": 24,
        "file_hash": "sha256:6d69e2a35226eff4064b7218f6564cbca9c52b6a3438b419ab588be12b30fc1c"
      }
    },
    {
      "id": "sym:app.models.order:Order",
      "kind": "class",
      "name": "Order",
      "qualified_name": "app.models.order.Order",
      "parent_id": "mod:app.models.order",
      "external": false,
      "signature": null,
      "docstring_summary": "Represents a customer order in the system.",
      "location": {
        "path": "app/models/order.py",
        "line_start": 6,
        "line_end": 16,
        "file_hash": "sha256:e0079461d1dd36a89376a50e28277281bb0e48def00d47e7b5139d13c77b3322"
      }
    },
    {
      "id": "sym:app.models.order:Order.is_valid",
      "kind": "method",
      "name": "is_valid",
      "qualified_name": "app.models.order.Order.is_valid",
      "parent_id": "sym:app.models.order:Order",
      "external": false,
      "signature": "(self) -> bool",
      "docstring_summary": "Check whether the order has a positive amount and customer name.",
      "location": {
        "path": "app/models/order.py",
        "line_start": 14,
        "line_end": 16,
        "file_hash": "sha256:e0079461d1dd36a89376a50e28277281bb0e48def00d47e7b5139d13c77b3322"
      }
    },
    {